{
  "success": true,
  "message": "command trim applied",
  "updatedEntities": [
    {
      "id": "ent-1",
      "type": "LINE",
      "geometry": {
        "start": { "x": 0, "y": 0 },
        "end": { "x": 80, "y": 0 }
      }
    }
  ],
  "deletedEntityIds": [],
  "affectedEntityIds": ["ent-1"],
  "boundaryEntityId": "ent-boundary-1",
  "boundarySource": "auto",
  "intersectionPoint": { "x": 80, "y": 0 }
}
