{
  "success": true,
  "message": "command extend applied",
  "updatedEntities": [
    {
      "id": "ent-demo-1",
      "type": "ARC",
      "geometry": {
        "center": { "x": 120, "y": 90 },
        "radius": 48,
        "startAngle": 0.1,
        "endAngle": 2.6
      }
    }
  ],
  "deletedEntityIds": [],
  "affectedEntityIds": ["ent-demo-1"],
  "boundaryEntityId": "ent-demo-boundary",
  "boundarySource": "manual",
  "intersectionPoint": { "x": 163, "y": 130 }
}
